{
  "schema_version": "ordin.command_pack.v1",
  "name": "docker",
  "version": "1.0.0",
  "description": "Docker container-runtime commands, effects, analyzer binding, and safety rules.",
  "enabled_by_default": true,
  "commands": ["commands/docker.json"],
  "risk_rules": ["risk_rules.json"],
  "effect_catalogs": [],
  "analyzers": ["docker"]
}
