{
  "schema_version": "ordin.command_pack.v1",
  "name": "git",
  "version": "1.0.0",
  "description": "Git source-control commands, effects, analyzer binding, and safety rules.",
  "enabled_by_default": true,
  "commands": ["commands/git.json"],
  "risk_rules": ["risk_rules.json"],
  "effect_catalogs": [],
  "analyzers": ["git"]
}
