{
  "schema_version": "ordin.command_pack.v1",
  "name": "systemd",
  "version": "1.0.0",
  "description": "systemd service control and journal semantics.",
  "enabled_by_default": true,
  "commands": ["commands/systemctl.json", "commands/journalctl.json"],
  "risk_rules": [],
  "effect_catalogs": ["effects.json"],
  "analyzers": ["systemctl", "journalctl"]
}
