{
  "schema_version": "ordin.command_pack.v1",
  "name": "azure",
  "version": "1.0.0",
  "description": "Azure CLI infrastructure, identity, secret, and transfer semantics.",
  "enabled_by_default": true,
  "commands": ["commands/az.json"],
  "risk_rules": [],
  "effect_catalogs": ["effects.json"],
  "analyzers": ["az"]
}
